Year,Review,Rating(out of 5)
2021,Can't get full view of any page.. the words are scrunched together!,3
2021,The quality of the clothes are beyond excellent! love everything!,5
2021,"Banana Republic is one of my go to stores and I primarily shop online. Now with the most recent update, it does not work at all. Very disappointing. I'm uninstalling the app now.",1
2021,"Crashes and barcode scanner doesn't work. Other brands apps have had barcode scanners for years. BR finally gets one and it doesn't work. Also if you are a big person, they don't want you in their stores. Big sizes are online only. However if you are in the store, quick scanning the tag to find your size is impossible. Fail Gap inc.",1
2021,"Unable to sign in, my password or email is incorrect but I can still sign on through the website....what's the point of this app?",1
2021,Very nice,5
2021,"Had to uninstall the app 3 times. Still won't let me search anything, or click on any headings or sections. Everything has an error message. Not a good update.",1
2021,I enjoy shopping on the app. it is easy and fast.,5
2021,"Like the ease. Hate that my Note 10 can't use the scan option to search. Always says item is ""Out of stock"" ... meanwhile on any apple device it works. Will be deleting app if no fix",2
2021,Can't access the factory store,1
2021,great store app,5
2021,This is a poorly written app. Cheap web app port with poor functionality.,2
2021,"This app runs well and easy to use. However, the suggested outfit pairings are unfortunately shown.",4
2021,It crashes every time I open it,1
2021,"""Something went wrong"" is all I see. App does not work at all for me.",1
2021,"20% discount when you order through the app, only you can't sign-in to your account on the app. Only Gap Brands would push such a woefully inadequate product.",1
2021,"App definitely has glitches and isn't always the easiest to use. Seems to be getting better than it used to be, though!",3
2021,I practically buy everything I wear from Banana Republic...it almost seems like their clothes was tailored just for me!!!,5
2021,Yes I love this store!!!?,5
2021,Great quality,5
2021,great app!,5
2021,improved new app!,5
2021,"Keeps crashing, useless.",1
2021,Can't use. Crashes when I try to login. Have changed password. Uninstalled and reinstalled app.,1
2021,"Why do I have to get redirected to the Google store to open new app...and, in new app...I cannot get to my payments. This totally blows and from reviews...has been going on for a month. Fix, or I quit.",1
2021,"Does not work it keeps showing a ""something went wrong"" message.",1
2021,Keeps crashing,2
2021,Good upgrade from the previous app but this still gives lots of errors when trying to pay credit card and contact customer service and several other errors. App keeps crashing and can't even use. Get it together BR!,1
2021,Crashes repeatedly on Android. Session expired when trying to log in. Uninstaller reinstalled rebooted phone. Still crashes. Unusable. Bring back the old version.,1
2021,"You want me to sign into the app, then I have to sign into the website. Just forget it. I'll shop somewhere else.",1
2021,High quality clothes!!,5
2021,Bad development ! Not sure why it has to route thru the app store every time I try to open it ? Keeps shutting down in between. This is not rocket science and a company your size shouldn't have these issues. App represents your brand image.,1
2021,app doesn't work,1
2021,The new app is not working properly,1
2021,"Like others have stated, the app keeps crashing when opened. It's useless. I guess I'll find another place to shop.",1
2021,This is where I find clothes in Tall.,5
2021,great product,5
2021,There is no way this app is rated 4.4!! This app won't allow me to sign in and I've been a member for years. Don't try to use this app.,1
2021,Can't get to work. The old app was just fine. Please fix.,1
2021,Not at user friendly. Previous one was much better. Really was there any need to develop such a stu.... appp.,1
2021,App is easy to use. Clothes are good quality. Never pay retail.,5
2021,This app is so much worse. I am not able to search for anything without a bar code.,1
2021,Have no idea why people are giving this 4 and 5 stars. I try to sign into my account and it crashes. Everytime. It's been doing it for a week now. ?????,1
2021,Crashes! Can't use the app at all.,1
2021,Exactly,3
2021,Fabulous fabrics and details,5
2021,It sucks and makes go to the website to verify my identity? That's CONTRARY to an APP,1
2021,Can't manage the credit card!,1
2021,great quality,5
2021,It's ok when it works but now it crashes on startup.,1
2021,Not directing me to the correct place,1
2021,This new updated app is horrible.,1
2021,"Quality clothes that are clsddy, fashion forward. Investment worth it.",5
2021,banana always has classic high-quality clothes that rarely fade over time...in style or fabric. my fav for years!,5
2021,Great customer service,5
2021,The app doesn't work I keep having to go to the play store to access,5
2021,Horrible user experience. The app crashes most of the time when I try to make a payment. And the UI is horrible. The chat Icon blocks my 'account summary' link,1
2021,"Won't open, just crashes. Worthless...",1
2021,"It has way too many glitches, can't pay my bill online anymore.",1
2021,Not working.,1
2021,"This app is a million times better than the last, the difference is night and day. About time too.",5
2021,Terrible cancelation service. I tried to cancel an order immediately after it was made and got a maybe we can do something.,1
2021,It doesn't give options make a payment.,1
2021,Keeps auto closing,1
2021,Way worse than the old app. Seriously?! CC payment not possible...,1
2021,"Terrible app,you need to make old accessible",1
2021,I don't like it also doesn't work well,1
2021,"New app doesn't work for credit card management and less user friendly for shopping than the orginal. I didn't know it was possible to make this app worse. When I input my log in information in the manage my credit card, it tells me that ""there is a problem with the information you provided, please go back and try again."" I am able to use my log in information on a desktop and it works fine.",1
2021,What happened to Banana Republic Factory?,2
2021,Installed it. Didnt work right. Uninstalled,1
2021,Very disappointed. Could not go to my charge account to pay my bill or look up rewards.,1
2021,Awful,1
2021,Sucks,1
