Year,Review,Rating(out of 5)
2023,"This is the worst shooping app ever. It won't open 70% of the time, and when it does its stuck on white screen and freezes my phone. I have a new phone btw not an old one. And if by some miracle you can get onto the app to shop it will barely let you see 5 items before it crashes or freezes. I've uninstalled it, updated it, messed with it in settings, and it's still horrible. Just use Google to shop.",1
2023,"Hit or miss on whether it even loads, too many items make it cluttered and slow (if you have 1 shirt in 13 colors, just list it once and not 13 different times!), frequently sends me ALLLLLLL the way back to the beginning of the scroll when I back out of an item page. That's a long way to go back when you have 10 of the same general item with 13 different colors listed individually. I've given up on quite a few shopping visits because of this.",2
2023,"After using the app only a few days, I can honestly say it needs work. As someone also mentioned in the reviews, Old Navy app does NOT need to make a listing for each item and its different color options. They should really just have the item once, let us click, and choose a color, mainly to save the user time from scrolling and from laggy app experience. On top of that, the app itself is really laggy overall and it's hard to navigate through when I'm trying to compare in-store prices vs online.",2
2023,The app has never worked properly and has only gotten worse with time. One of my biggest complaints being you can no longer make your card payment in the app. This is only second to the fact that if you are browsing and select an item to see colors and sizes and then go back to browsing you are returned to the top of the page and completely lose your spot. Get it together.,1
2023,"The app has always been a bit hit or miss, but it's been basically unusable for months. I can no longer pay my CC on the app either. It hasn't updated since March, even though the payment history and balance is correct when I call. The favorites page never saves anything even when logged in, if you're even lucky enough to get to the shopping pages. Usually, it just gets stuck on a loading page. I'm just going to delete the app and only shop in store. It used to work great but not anymore.",2
2023,"App has been super glitchy, doesn't load properly. App keeps telling me pages cannot be found, when I'm scrolling through items it will put me back at the top of my search. It does the same thing I've looked at an item too. I've also had issues with my credit card payments not going through on the app. It's way easier, and safer, just to use the browser. The app isn't worth the hassle anymore.",1
2023,"The app has been extremely glitchy for a while now. When trying to scroll, the app hesitates and idles each time to move down the page. If I click on an item to view and hit the top back arrow to go back, the page refreshes and takes me back up to the top instead of staying where I left off. Because of these frustrating issues, I have not purchased anything out of frustration of having to repeatedly start over or the app taking too long to respond to a simple page scroll.",2
2023,"The app seems to lag alot. Occasionally, I'll be searching and the app will just close. Another frustration I often encounter is when I click an item to view more images, colors, or sizes and decide to go back, my place does not get held. It sends me back to the very top and I have to find my place each time.",1
2023,"I feel like the rating of this app is just based on the store and not the app. The app is terrible! Everytime I download it, I have to delete it again and again. Nothing improves. Sometimes it doesn't load, sometimes it tells you an item doesn't exist, it doesn't take you back to the same spot on the page after you view an item, etc. Needs a lot of work",1
2023,"This app never works well. It sends you back to the main menu if you click to go back from looking at details for an item. So then you have to find where you lost your spot every time. This happens when you add something to your cart too. It takes forever to load and it's not me, everything else loads quick. Target, Walmart, h and m. All quick. For how much money this company has, you'd think they'd have better technology.",1
2023,"The Old Navy app has been consistently frustrating and glitchy for months now. When I try to load the ""shop"" page, it gets stuck on a loading screen permanently. When I try to open the categories for shopping, sometimes it opens, sometimes not. And half the time even if it opens, when I select a category to shop, I get an ""uh-oh something went wrong"" page. So frustrating. Frequently resets me back to the top of my search. Just a really obnoxious unreliable app.",1
2023,"App has not been able to load consistently for months. Just gets stuck on a loading screen. On the few times it does work, I can do one search and then it will get stuck. Super inconvenient when I want to see my rewards or supercash to use in store. I used to love making in app purchases, but I haven't been able to make any since around the new year. Gap, Inc... FIX YOUR BROKEN APP!",1
2023,"The app is super glitchy. If I click on an item to see more sizes, color, etc., it doesn't hold my place and just puts me back at the top of the screen. This makes me abandon my shopping spree entirely. I'm not going to repeatedly scroll through the same 100+ items just to get back to the same item I was looking at previously.",1
2023,"I love Old Navy and the sales, but the app is really unreliable. Often doesn't let me sign in so I have to use the browser on my phone instead. Today the app let me sign in but loaded some stuff slow, and also when I would tap to view an item and then go back to the main list I was at, it would shoot me all the way back to the beginning after I'd scrolled down past hundreds of styles. Very annoying.",4
2023,"This app is so bad. It takes forever to load any items while you are browsing. When searching under ""Women's"" it will consistently give you an error stating something went wrong. While scrolling through clothes, it will randomly kick you back up to the top of the list to the very first item. It's just so bas, avoid this app at all costs.",1
2023,"Consistently one of the worst shopping apps I have ever used. I have to open, close, and reopen the app several times in order to get it to work. Even then, it tends to crash and exit out of the app on its own if I'm on it for more than 5 minutes. Oftentimes items that are supposedly in stock will say out of stock when I try to add it to my cart. Using this app is never an easy or pleasant experience.",1
2023,"I love Old Navy, but this app sucks. It hardly ever works, (crashes, stays stuck on the loading screen, constantly takes you back to the top of the page for no reason) and NEVER works during a sale. I'm almost never able to successfully complete an order before I have to give up out of frustration. PLEASE fix this.",1
2023,"It won't load pages. Multiple error messages. It's twitchy and glitchy. When you are scrolling and look at an item, it takes you clear back to the top of the search when you exit out of viewing that item. Beyond annoying. I can barely shop with this app let alone access my credit card payments/info without a fight. Can't stand it.",2
2023,"Old Navy's App is terrible. Please pay for better programmers. The app never loads up any items pages recently, it freezes all the time, and it's overall janky user interface when it comes to selecting a different color of item to be shown has to scroll through every other color before it gets to it. I stopped using it because it's so bad.",1
2023,"Update: 6/11/23 - This app is awful. Super glitchy. So bad I can barely use it and just end up going online. I can't understand why this app feels so amateurish/low quality. I'm annoyed by the login feature. Maybe this is my phone, but whenever I use the app it doesn't automatically save my password so I have to type it in each time. Again, could be my phone is the issue. Once I get into the app though, navigating feels clunky. It works and I can shop but something about it is just clunky.",2
2023,"This app hardly ever works. Pages won't load, will randomly return me to the top of the page as I'm scrolling, hard to search for items, etc. I am continuously checking for updates when I use the app to see if it will resolve the issues, and after months of the same problems, I've reached max frustration. Time for a revamp Old Navy!",2
2023,"The app works ok if you are willing to scroll for hours to find what you are looking for. I get almost daily notifications for sales, but if you try to click yhe notifications just to look at the sales, you will sit until you are old and gray waiting. I have uninstalled and reinstalled several times, I keep it updated to the latest version at all times, and still I cannot shop the sales unless I just use the website.",1
2023,"Old Navy app and website is the glitchiest and worst shopping app/website I have ever used!!! First went on regular computer to shop online, it wouldnt let me log in, kept saying error and need to refresh. Tried that for half an hour, gave up and decided to download the app to finish my shopping. I wanted to delete an item off my shopping cart in the app, kept telling me error and still had the same item twice in my cart which I couldnt remove. I spent an hour trying to PAY for my stuff!",1
2023,"The app closes repeatedly. It often won't load and gives me an error message when I try to shop. When it finally does load, and I'm able to shop, it's a very frustrating experience. When there are many items to look at, after clicking on something, instead of going back to where I left off, the list reloads to the beginning and I have to scroll back through everything. When there are 200+ items this is very tedious. I haven't purchased anything in a long time because of this.",1
2023,"This app makes shopping impossible. If you click to view an item more closely or even put it in your cart, when you return to your shopping it puts you back to the top of the list, and you have to scroll ALL the way down again. When you make changes in your cart, it then changes the order of the rest of the items in your cart too, so you have to go back up to the top again. Any time there's an update, I have to uninstall and reinstall, because the app stops working. This app is terrible.",1
2021,"The new app is time consuming. I can't pay my ON card thru this app, there is always an error--so I have to log in on my laptoo. When you click on an item to see color options/sizes, when you go back to the list, it starts at the beginning, sooo frustrating. When searching for Men's items, using the size filter ""Tall"" is not an option, so you just have to scroll thru to see what is available. I'm sure there are other issues, but these stand out the most. I love ON, but this app needs work!",2
2021,"The new app is awful! It never works properly, I can't access my order history or wallet, it gives an error that something went wrong or temporarily unavailable. Very frustrating. Also, when browsing, if you select an item to view more details about it, upon going back to all items it brings you to top of page, not where you left off. Selecting a print when multiple print options are available is very confusing. I don't like anything about this new version.",1
2021,"Can't access credit card information to pay bill. When shopping, when you're done looking at an item, you get sent to the beginning of listings instead of where you left off. Also rearranges the order of items displayed. So I don't click on many items unless I really, really, really want to see more about it. Probably could have made more sales off me if this app were more user friendly. Super annoying...",1
2021,"Returning to search results from item details sends you all the way back to the very beginning of the results, even if you have a couple hundred results to sift through. All right, I decide to simply add items to my favorites list from the search results page, and sort through them later. But the app does not save my favorites, as I discovered 40+ items in. Borderline unusable if you want to make a large purchase or think at all about what you're buying.",2
2021,"I love the ability I have to scan barcodes to find the item I'm looking for although I wish there was an option to choose a size after scanning the barcode. It also requires me to sign in constantly and its frustrating, especially when I can't even track my orders because every time I go to my orders it displays an error message. Ever since the update I can't do anything without it saying something went wrong and just doesn't work.",1
2021,"The old app was a pain. It froze constantly and took forever to move things in your cart. The new app doesn't freeze as often, but it has one glitch that is highly irritating. Whenever you look at an item and back out, you are brought to the beginning of the section. This could be after scrolling down dozens of items. Wouldn't it make more sense to resume where you were at previously? Changing this would make the app infinitely more user friendly. Also, why was the Tap to Apply option removed?",3
2021,"The new update is trash. It can't be that hard if other stores can do it? My complaints are all the same as everyone else's. Slow, the app never opens right, impossible to browse or sort efficiently. I think I'm done shopping ON until it's actually easy and affective to use. Saving time is the point of having an app. This one absolutely doesn't do that for me.",1
2021,"The new app is extremely annoying because while you're browsing a giant list of items, you choose something to look at closer, then back out to the list and it puts you back to the top of the page rather than where you left off. I've submitted app feedback multiple times but I'll be using the mobile site til it gets fixed. Edit : after posting, I'm so glad to see almost every other review is about the shopping/scrolling issue! Maybe they'll eventually fix it but it's not looking promising",2
2021,"The updated app is worse than the previous version. The only improvement is having Super Cash codes available at checkout without having to log in again. The filter feature is useless, the low to high/high to low price sorting feature is gone, the fit bars (overall size, chest, waist, etc) are gone so you must read reviews to determine if something is true to size, after viewing an item you are returned to the top of the page instead of the last item viewed, and the Factory option is gone.",2
2021,"I like the Order History in the old app much better. It was easy - all the important info is on 1 page with pictures, order date & number, status, all partial shipments, cancellations, delivery date etc. It utilized colors and was intuitive. You didn't have to click all around to get what you need. The new design is all text, unappealing and hard on the eyes. I have 40+ orders and it's a pain to navigate.",3
2021,"The new app is not user friendly at all, especially the checkout page. I would chose my ON credit card as the payment option and then put in the discount code and it would switch the payment method and put in a different code that raised the price. I had to redo the checkout multiple times to finally get it to work. Sometimes the account page doesn't load so I can't even make my credit card payment. Please fix the flaws or go back to the old app. It was clunky, but better than this.",1
2023,"This app is absolute trash. When clicking on the Shop option and going into a certain category, you'll get a ""something went wrong"" error just about every time. If you click on an item and back out, you will return to the top of the page instead of where you were on the list. The filters for size and reg/tall are basically useless. Maybe it's just an Android issue, but it's very frustrating considering how many emails I get from Old Navy.",1
2021,"What a downgrade!!! The flashy new features don't hide the terribleness of this app. The search and filter feature are unusable. The search feature doesn't pull up what you are searching for...I literally typed the name of the item and none of the items pulled had the words in the title. The ""filter"" feature doesn't narrow the scope. Seems like they tried but released something half finished. Old Navy, you can contact me for more info. I ran out of words on this review so I erased the details.",1
2021,"App is easy to use but when you scroll through and click on something, and then go back to the list, it starts you over at the top. Very frustrating. Considering it is a continuous scroll i could pass 100's of dresses before finding one i like. Only to go back and have to pass the same 100+ items all over. Too time consuming.",2
2021,"This app CONSTANTLY give you a ""something went wrong message"" where it doesn't let you do anything. You try to log out and it give you a ""sign out failed"" message and it just doesn't let you do anything. After countless attempts, I have no choice than to use my computer only to track a package. And, when it's not getting stuck, it constantly logs you out. In my opinion, it's a useless app.",1
2021,"Old Navy... What happened?? This was always my go to for basic men's essentials like Tees and shorts. But the new App. Is horrendous! You cannot find anything you want quickly. The only good thing about the app., Is the product pages are finally faster. Also, the Awesome vast selection of items has disappeared!! Very limited selection and it seems all Tees have pockets now with fewer color selections. Everything seems to be in fewer colors and options. Just sad it's come to this. ??",1
2022,"Too many glitches to function properly. I can't even add more than a few things to my cart before it tells me ""something went wrong"". After trying to build my order and getting interrupted for the third day in a row, I just switched to the site in browser. Unfortunately that's terrible too! Between the app and the website, it completely messed up my order, duplicated some items and dropped others - which are now sold out and/or I won't get free shipping on. So incredibly frustrating.",1
2023,"The app is super glitchy. I will sign in to shop or check my card balance, but then it gives me an error page constantly (my login credit are not incorrect, it's almost like a connection issue with the app). When I am shopping it won't save things to my Favorites list. Also when I click on an item and I want to go back to keep scrolling, it takes me back to the start of the page instead of saving my spot. So, I have to scroll down to where I was at. Super frustrating.",2
2022,"This app constantly has issues: can't load pages, jumping back to the top of the page once you click an item, not saving favorites, and more. I just went through and favorited things I liked since I had to scroll back through the entire page every time I viewed an item. I went to my favorites, and it's completely empty. This app has no issues notifying you about sales multiple times a day, but when you go to shop, you can't simply browse, save, or purchase items without some issue arising.",1
2022,"I'm sure it's great in theory, but unfortunately, when I select a category, it just hangs... sometimes it will load, but more often than not, it doesn't. And if I jump over to look at my bag, I can't return to whatever I was looking at on the shop tab. Search filters aren't helpful - especially with sizes. the app's in store inventory is never accurate. It's easier to just go shop in person, because so many items are incorrectly marked ""unavailable"" at those stores according to the app.",2
2022,"Glitchy App When it works, this app is fine, but it's constantly freezing and glitching. I get a ""could not refresh"" screen frequently, and it also keeps telling me my rewards points are ""temporarily unavailable"" and to ""try back later"". It's gotten to the point that it happening so often that I've just gone back to the actual website for my online purchases. They really need to work out these annoying bugs.",2
2021,"I am not liking the new app experience at all. It is super hard to navigate through the app and find things. And the worst part which is a big pet peeve of mine is when I am shopping and click on an item to add or just look at, when I go back to browse on the previous page, I have to start all the way at the top again. In short, it doesn't save your spot. The layout is ok but I think it needs some definite tweaking.",1
2022,"I agree with other reviewers. The app is glitchy and super frustrating. It asks me to sign-in every time. I also enabled the fingerprint to help me avoid the issue but it doesn't work. As I'm browsing, it abruptly stops and takes me back to the main page. This also happens at check out. I swear it makes me want to delete it and never look back.",2
2022,"App is very slow, and 99% of the time nothing loads. If the app does load, and you click on an item, 99% of the time the app will crash. I've passed over many sales, and many clothing items, because it is easier to drive to Target (and use their app and drive-up feature) than it is to deal with Old Navy's app and curbside pick-up service.",1
2023,"Operating on a Google Pixel 6 XL. They say they've made updates to fix bugs and streamline the sign in process, that is a bold faced lie. Now when I try to browse through app, if it even wants to load a page, it will sign me out multiple times. Pages randomly reload when browsing. Filters don't work the way they need to at all. Used to love using this app but over the last year it has gone down the gutter with functionality. Get it together developers! ??",1
2022,"This app is trash. It is always so glitchy. It never keeps me signed in. When browsing, after you look at an item and want to go back to the main browsing page it returns to the top, not wherever you were and it puts the items in a different order, so you can't even go back to find where you left off. So many error pages. I love Old Navy, but I HATE using this app!!!",1
2022,"I love Old Navy and order here often. The last week plus, it will not let me view products or add to cart! This bug is sending me to the log in screen every time I try to view or add to cart. When I log in, it returns me to the home page. Then, when I try to view the product, it sends me back to the login page once more. I would have purchased orders in the past week if I could! You are losing money! Please fix so I can order what I want!!!",1
2023,"Shipping is $9 if you don't meet the threshold for free shipping ($50). Met the threshold, go to checkout, and there is a $7 shipping charge. ??? No way to contact customer support. Every time you hit the back button, it will start your search all over again. Many of the sections of the app simply won't load or do not function. The filter options are a joke. Much of the items ""available"" for sale are not available at all. Horrible user experience.",1
2023,"The app lags a lot before and after updates, when it loads at all. It is not all that easy to navigate because it is slow or it doesn't save your information so I always have to log in or navigate as a guest account. I enjoy shopping in stores anyways, and the app used to be easier to navigate, but there is rarely a time where everything runs smoothly anymore.",2
2023,"The app, while relatively nice, likes to refresh and put you back to the top of whatever you're looking through after some amount of time, regardless of if you're scrolling or just looking at a few things. And if you're looking at a broad spectrum, good luck getting even halfway through without it sending you back to the top of the page.",3
2023,"""Something went wrong"" is the only thing i get. My app is up to date on galaxy s22, but i cannot for the life of me shop on it. No page opens up. So i get fed up and go my web browser. Another issue the app has is when you are browsing and clock on an item to view, when u go back to where you left off browsing, it does not take you back to where u left off, it takes you back to the beginning of the page and resorts all the items..so you literally have to re-scroll through all the items.",1
2023,"Worst app I've used in a long time. Prevalent issues with being returned to the top of a list while browsing, hitting the back button after examining an item to be returned to the top of the list and pages simply not loading. This level of poor performance is unacceptable, especially for such a large company that's been around for so long - since the 90's",1
2022,"I used to love this App but unfortunately, it doesn't function properly anymore. Pages need forever to load. Most of the time I get the info that something went wrong, or it won't let me access ""browse by departments"", and the ""my favorite"" feature is not working anymore for over 3 months. I tried to open a tech ticket with customer support but this doesn't seem to be an option. They just told me to use the browser instead of the app.",1
2023,"Glitches I'm the system! Takes forever for the app to come up so you can even sign in or pay your bill. Also if you go back, it starts from the beginning of your search. Have to keep putting in the filters to kinda sorta find what you want to look at. Also super bucks are a nice thought but you must purchase a high dollar amount to use them and wait for months to be able to use them. Not a system glitch but something maybe to look at also.",2
