Year,Review,Rating(out of 5)
2023,I have shopped Old Navy for years. I actually cried when they shut down our local brick and mortar store. So now I use the app.,5
2023,"This app sucks. It doesn't show you your purchase record, and it won't let you make payments.",1
2021,This app now Sucks!! I've been trying for 30 minutes now just to pay my bill and have had to sign in 4 times and put in my info to pay 3 times with a error everytime. I even Un-installed and re-install but it didn't help. I knew there were going to be issues as soon as I tried to open the app and immediately had to go to the Play store to update and I did that last month!! I may have to close my account. Just too much hassle for me to spend my money.,1
2023,"I hope the developers read all these ratings. Everyone seems to be having the same issues with loading and things generally not working in the app. I also did an uninstall/reinstall and still no fix. Biometric option also not saving/working. I love Old Navy and hope they fix it soon, they are losing sales from the app not working again.",2
2022,"Log in issues every time. Every. Single. Time. I try to log in, it tells me it's wrong, I type in something random to get it to tell me it's wrong again, then I type the first thing I typed in, and it tells me it needs to take me to the site to verify. BUT THEN it just spins and spins and spins and never loads the website. I have so much in my cart, just let me log in so I can buy some stuff! So aggravating. Fix this, and I would use this app a lot more.",2
2023,sometimes it's slow but not too often,4
2021,"This app is terrible. I try to go into OldNavy to check my credit balance, make a payment, etc, it always takes me to GAP or Banana Republic. It takes forever just trying to log into my account. I always end up having to go through Google and inputting ""old navy"" into the address bar to log into OLD NAVY. This app is a waste of time. It's just an advertisement of their stores and products.",1
2023,"This app needs some work. Most of the time the main page won't load, when I try to filter things out it doesn't work, when I try to shop for my toddler the page doesn't load and keeps saying refresh. It gets really frustrating. I'm really surprised with this being a big brand that their app isn't better.",2
2023,This is one of the most frustrating apps I have ever downloaded. 96% of the time it doesn't work. It works seamlessly until you get the the page you want to be on then it just buffers and never loads product. I inevitably have to go through the official website and it's not much better.,2
2022,"Downloading and shopping on the app was easy. However, I have been trying to checkout for two errors and keep getting a message saying that something went wrong. This is extremely frustrating because I had super cash that I needed to use by today, but it's not letting me. So I'll have to shop somewhere else.",2
2023,The clothes are not revealing for girls. They're modest and I am so grateful for that. My son adores the fleece sweats and shirts.,5
2022,"Just use the site. 1. Majority of the time the app just spins, never loads, especially when you're trying to check rewards or cart. 2. You have to login constantly. Never saves account or credit card info so you're constantly logging in while navigating the app to shop, buy, checking rewards etc. what's the point of the app, it can save my cart but not password!? ??I'm uninstalling this AGAIN, I end up using the site anyway",1
2023,This app loads so ridiculously slowly that I usually give up before it loads. I also hate that there are a million updates and every update signs you out.,2
2022,"This app is terrible. It's only good to view your account or current orders and order history. I have to constantly sign on even when I have saved my info. Everytime I try to use it to shop it never opens and when it does it says ""something went wrong"". I have to use the browser to do my shopping. Please fix, if not remove it. Its worthless.",1
2021,Improvements are supposed to make it more user-friendly and streamlined not create a bigger mess. I have the app installed but every time I go to open it I automatically get a notice to go download it from the play store. If I want to open the app I have to click the link that directs me to the play store then launch it from there. Not worth the hassle of bothering to have it installed if it's not going to work.,1
2023,Keeps crashing. What is the point?,1
2023,The app has not been working in over a month. I try to log into my account and it keeps giving an error message.,1
2021,"It was not great before, but this app is TERRIBLE since the recent update!!! I can't access my wallet, my rewards, anything about my ON Credit Card account, and what a complete waste of time trying to shop because it takes you back to the top any time you look at the clothing details, then return to the item list.",1
2021,"the app is just as bad as the website, if not worse! it constantly crashes and won't allow me to checkout. it emptied my cart multiple times, and every. single. time. I log in, it tells me to change my password. very frustrating and inconvenient!",1
2021,"This new app literally sucks. Any time you view an item, it takes you back to the top of the page. And right now, I was trying to checkout with a rather big order, and I put all my info in and hit ""next"" to pay, and it says ""uh oh, something went wrong. Please try again"" at least 10 times. Extremely frustrated.",2
2023,Great selection and variety,5
2023,App can be glitchy at times,4
2023,Great clothes and great prices,5
2023,Love Old Navy. Most of my wardrobe is now Old Navy!,5
2023,Great app. No bugs yet ??.,5
2023,Clothes are great quality.,5
2023,wish more plus sizes can be found in stores,4
2022,"I've had this app on and off for years and it has always sucked. It's slow, makes you sign in multiple times while using it, if you view an item and then go back, you start again at the top. It's just a terrible app, and I love old navy and best deals online so please make your app more functional.",1
2022,"Best site to shop for clothes!! Easy exchanges, always can buy Tall sizes!! customer service is always knowledgeable, helpful, and understanding. If flaws or poor quality item ( which I have had once) no questions just returned and money back. Always keep things in my cart and Texts or emails notified of item on sale. Also if you purchase item and it goes on sale...you just call in and they give you credit on acct for price difference.",5
2023,I cannot see my virtual wallet and its been this way for a few weeks now. I'm letting tons of people know to download the ap. Please fix the issue.,3
2022,"Inventory is never accurate. I use several retail stores apps, and none of them are this slow or have items either unavailable, or unavailable for buy online pick up in stores. I've reinstalled and signed out then back in, but the entire experience is the worst.",2
2021,"When scrolling and browsing, if you click an item to look at and go back, it returns you all the way to the beginning. Very annoying. But at least it gives you the ""Like"" option, so I'll just ""Like"" the item and view it in my Favorites.",2
2023,Nothing in the app will load. Even their online website has trouble with it being glitchy and not loading.,2
2021,"Using this app is just as annoying as using the website. It's hard to narrow down searches. What I hate most is having to sign into it. For some reason I think apps should be about convenience so when I have to sign into one every time I use it, I hate it. Since I can't save password I hate it even more. It should be required when you go to buy or access profile. Verification code? Fine. Hate having to remember passwords to apps I hardly use. For this one I just go online where it's stored.",1
2021,The shittest app on earth. Cannot login even after my login id and password are saved and autofilling. It keeps telling me its the wrong password when its not. Locked my account for no reason. They will make it as hard as possible for me to make a payment so that the late fees can pile up. Update your existing app. Dont make me download 100 different apps.,1
2021,App never works. Can access my wallet or pay my bill. When you select an item to look at and go back it takes you to the top of the page and not where you were. Very frustrating to have to scroll through everything again.,1
2021,"I placed an order through the app which is the first one I've placed with Old Navy in years. The order process went fine, but somehow the app deleted my apartment number, so now there are 2 packages floating around with UPS containing an entire winter wardrobe for my kids and no one knows what to do besides cancelling the order, refunding it, and resending it. Not one customer service person has been able to help in any way.",1
2023,"Well...it used to work great. Now you can't even open any of the tabs. All give a ""something went wrong"" error message. What's really frustrating is that when it does work, if you select an item to view the details, you lose your place where you were scrolling, and sends you to the top of the page every time. It's very annoying.",2
2022,"FIX YOUR APP PLEASE. It is so hard to use due to glitches and it constantly logging me out of my account. Pages take a long time to load even when I'm on a strong internet/wifi connection, my cart has glitched out requiring me to restart the app, and last time I tried to make a purchase in app it just told me ""something went wrong"" and it couldn't continue with the purchase. Restarting the app, logging in and out, and deleting and redownloading didn't help. PLEASE fix your app",1
2021,I don't know what they change but it was on July 15 2021 and the app was working perfect. I went in the next day July 16 2021. I click on the app a screen came up and said the app has stopped working. I tried the other apps the Gap app the same thing happened. I cleared cache I cleared all the cookies started my phone and it's still the same issues I don't know what you changed but change it back. right now I'm going to the website through Chrome that is my only other option.,1
2023,easy to shop and check out!!,4
2022,"app was okay until the latest update and now I can't view my shopping cart or even add anything to it. every time I try to it asks me to sign in, I sign in, it says ""something went wrong"" and offers a ""refresh"" button to try to fix the error ... and nothing happens. I straight up cannot shop this app anymore because it won't let me add items to my cart or view the cart. completely useless.",1
2021,"Having a hard time with this app. Cant even use my rewards. Whenever you click on an item while browsing, then go back to browsing, it takes you all the way to where you started. So annoying that it doesn't go back to where you last were like the previous app.",1
2023,Quality and cute clothes at GREAT prices..mahalo!,5
2021,"Had an order with Super Cash go through- two days later, it got cancelled without warning. I had to email to find out none of the things I ordered were in stock. The app and website said they were available. Customer service was awful and they only offered me 10% off my next order, and when I asked about the Super Cash I had used, they completely blew me off. If you're gonna have an app for people to shop on, try updating the stock once in a while. I'll never shop through this app again.",1
2022,"we really like the app, seems pretty easy to use and like how you can change stores. There are a couple problems 1 is the login screen doesn't show up properly, have to login blindly assume the enter takes you to password entry. 2 is product description and pictures jump around sometimes.",4
2023,It genuinely doesn't even try to work. The best I can do is log in. Then nothing. Pictures don't even come up.,1
2023,I've been able to place 2 successful orders on the app in the year that I've had it. Now i can't get a single page to load to even think about adding stuff to my cart. Its a huge waste of time. You're better off going to the store or using your web browser to look at their website.,1
2022,"Love the products, but the app itself is extremely inconvenient. Constantly logging me out is the least of my worries; it's the fact that it doesn't save my favorites, the home page never loads, and it's always glitching when I'm switching between images.",1
2023,App not working correctly it will not open always says refresh. This has been an outgoing problem.,1
2021,"OOPS! Something went wrong with this App! This isn't funny when your email directs to your App that never works. If you don't know how to build an app, try going back to retail..Every search, menu change, or click is broken and crashes the app. OOPS, isn't funny when it repeats at every page change.",1
2023,"I think the app could be good, but every time I click on a notification that alerts me to a deal, it never opens the deal and then I can't find said deal in the app. It also reloads quite frequently, which is frustrating when you are pagea into searching for something.",3
2021,"This app is terrible, features never work half the time, and besides just the app, online shopping with Old Navy is always a headache and not at all worth it anymore. I've finally used up all my credit card rewards (and every online purchase using them was a hassle with multiple customer service calls-- plus a toss up on whether or not the CS rep would be helpful or a jerk-- since the app was constantly not functioning), so I'm done using the credit card and done shopping at ON.",1
2023,"If you're a regular Old Navy customer very useful app. Cell phones have such limited space you have to pick and choose which apps are most beneficial. I prefer in-store shopping. Being on a fixed income with today's high gas prices it's good to know if it's worth the drive. Lovely, well made, inexpensive clothing and fantastic sales. I scored a $70 dress for $3 at an end of season sale! This one is a keeper for Old Navy regular customers.",5
2022,"Idk why, but the app signs you out every day, so you have to sign back in. That'd be fine, but auto fill doesn't work on this app, it's the only one. It works for the old navy website, it works for every other app, this is the only one I've ever had a problem with. Useless to me, because I'm not going through my Google passwords and copying and pasting the gibberish password every time. ???????",1
2023,Love when I can buy my kids t-shirts for $7. Nothing cost this much money now days!,5
2022,50% of the time I LOVE this app. Love the ease of it... until there is a substantial sale running. Then the app won't even open! I can't get the app to open for more than a moment before it closes itself and offers an error message. Beyond disappointing to miss sales because they can't handle to load on the mobile app. Atleast try to fix this! Update: it's no longer just malfunctioning during sales. I can't even sign in and place an order. I'm going to cancel my CC and take my business elsewhere,1
2021,"Went from a 4 star app to a 1 star app. I cannot sort the items to find what I need anymore. The orders page hasn't worked since this update. When you hit back, it takes you to the top of the page instead of back to where you were. This is all around trash. Please fix this. The previous app was kinda old, BUT AT LEAST IT WORKED!",1
2021,Great leggings at affordable prices. Most of my workout/exercise clothing comes from Old Navy because they fit well and have a wide variety of colors. I'm not into the typical black/gray. I have a huge assortment of their colored leggings and tanks to mix and match. I dont believe in the spending around $100 for just one pair of leggings. I like options and variety. Try them.,5
2021,"Lately it won't stay open, I hit it it opens for one second then closes immediately! Very frustrating. I also agree with other, I hate that if you go look at an item when you return to the list it goes to the top of the page.",2
2021,"I had to uninstall and redownload the app just to log in and have all these log in issues. Now it keeps saying ""uh oh there is an unexpected error"" and asks me to hit refresh, and when I do it just spins. When it's not doing that, it's telling me my passowrd is wrong and prompts me to change it. On e I change it, I'm told it's incorrect again.",1
2021,App worked wonderfully the first time I used it (looking past that there's no way to sort items only filter them). Made one purchase via this app and it has been crashing ever since. Literally can't get it to do anything except show a glimpse of the page then it shuts down. Over and over.,1
2021,"This app is better than their old one for sure. My main frustrations would be the page scrolling back to the top when you back out of a specific product, and not being able to pick the rise of women's jeans (that I can find). Other than that, it's good!",3
2021,"App is literally unusable. I get an error every time I try to look at anything. The main page loads fine, but when I tap on any section, I get an ""Uh oh, something went wrong"" error with the option to refresh. Even tried reinstalling just in case, but get same issue.",1
2023,"App rarely ever loads correctly, I only use it to find out deals so that I can sign in on my laptop later to buy the stuff, seems like you guys could care less about making customers happy if the app still sucks this bad after having it for a year. It's more of a disappointment if anything, I wanna buy stuff from old navy but I literally can't because you guys can't make a simple app that works. I hit the jeans button and it says ""something went wrong"", I hit anything and it takes forever.",1
2022,"App used to be good you could pay your bill through the app but not anymore. You have to go through play store to open the app every time you use it and now it keeps showing ""error"" every time you try to check out. Has to be the app because going directly to the site without using the app you can check out etc. Fix the bugs PLEASE!",1
2021,"Awful app. The old one was better. This ""new and improved"" version never works. It's always giving the ""Oops! Something went wrong."" message. You can't view any of the departments, only the home screen. My app is up to date as well as my software and all that good stuff and it still does not work.",1
2023,"the android app is pretty buggy and pages often don't load, or the app crashes.",2
2022,The app just keeps getting worse and worse now it doesn't even work. Every time I use the app it sends me to the Google Play store to tell me to download the new app which I already have. I then have to click open in the Google store to take me back to the app. Now when I go through all those steps the app shuts down regardless. And if you place an order online as opposed to placing it on the app even though it's your account you cannot see it on the app.,1
2022,"This app used to be flawless, but over the last few months, the cart & checkout fail to load consistently. This forces me to switch to the website to check out. Now, only the home page will load and I cannot view any of the actual shopping pages. This app has been rendered nearly useless.",2
2021,"First time user. I lived the app, for one day, mostly because I found that items were unclickable on the online site. Come to find, it was because items were out of stock. After 4 hrs of the app, it had errors and would auto shut down?! So annoying. Especially when I was so close to checking out finally:(",3
2022,"I have always shopped using the app. Now it makes me sign in over and over, I can't add to or view my cart. So far I haven't been able to shop the jeans sale, swim sale, or active wear sale, and that's just counting this week. I've tried clearing the catche and uninstalling and reinstalling the app. To no avail. Also if you have supercash and it goes unused you can turn it into points right. Seems good but $100 in old navy supercash is 100 points which only equals $1.00. Boo ??????",1
2023,Old Navy has great prices!,5
2021,"DONT INSTALL!!! Sends push notifications non stop until you turn off, constantly have to keep logging in, error message over and over when trying to browse. App does not make things easy. It's basically a way for Old Navy to push ads to your phone.",1
2021,"I don't understand the dislike for the new app. It's 100x more responsive than the old one. Search results are almost instantaneous. Maybe some features that I don't use have been removed or regressed, but I haven't seen any loss of function for me. Provide feedback and I'm sure updates will come. I'm happy with it.",5
2022,"I love Old Navy clothing! I am always able to find really great tops, dresses, jeans and more in my size! The sizes are true to fit a sz 12 is a sz 12 and not a sz 8! The no hassle in store return policy makes shopping online (for those of us who like to browse without time limits) my preferred method of shopping. I really appreciate the the inclusion of all sizes at the same price by Old Navy.",5
2022,"the new app isn't as user-friendly as the previous one. it also crashes a lot Edit: they did another app update. Now it's unusable. All you get is a spinning icon as it tries and tries and tries to load. Alas, nothing ever loads and the app is unusable.",1
2022,"I love old navy, their styles have come so far in recent years! I also love their new app. It is connected with their credit card so you can see your balance right from the app instead of having to log in to the actual credit card app. Very user friendly.",5
2022,"Horrible app. Any positive reviews must be fake or about the clothes in general, not the app. It is extremely glitchy. I have never come across a clothing app with so many glitches. Loading errors, checkout errors, signs me almost every time. Searching for items always reloads me back to the beginning. This app has all the problems. Avoid using if possible.",1
2022,"Everytime I log in, I tap on my card to make a payment, and it says there an error. EVERYTIME. Update 10/14/22. Making a payment is now completely useless with this app. It's saying that I have a balance due for 9/2, but when I go to the actual website on a browser, it says I have a balance of 0.",1
2021,"Love the Old Navy app but it keeps giving me login trouble. Everytime I try to login it says my username and or password do not work. I have reset password multiple times, I have uninstalled and reinstalled the application, I have reached out to old navy about the issue and they reset the password and I make a new one. Still does not work with the app. I dont know where it is malfunctioning but i wish it would work. I love the app, when it wants to work which was very brief for me.",3
2022,"What did you do to the app? It no longer works, it keeps asking me to log in, right after I log in, and won't add anything to the cart, just keeps saying uh-oh/refresh. I switch to BR and it won't let me browse, keeps saying the same thing, uh-oh/refresh. I even uninstalled&restart to see if it would fix, but it wasn't that. Fix it.",1
2021,"Decent clothes and deals. Not fond of the elastic in the tops of the more reasonably priced leggings (very thin and uncomfortable for what you usually want to wear leggings for) or the general, common length of the shirts for plus size. I'm not huge, but I prefer my mid section stay covered.",4
2022,"The app was just updated in my device and I am trying to place an order but unfortunately it has the sign in bar over the box where I am supposed to enter my password. So, I am not even able to sign in. Thanks for nothing. Here it is June 5, 2022 and the app is still not allowing me to sign in. I can only enter my email, the box to enter password has the sign in bar over it. OLD NAVY you all need to do better.",1
2021,"I HATE THE NEW APP?????????? I tried to uninstall it and go back to an older version but I knew it wouldn't work. Silly me I was thinking there was a glitch and the reinstall would fix it. NOT?? Then I scroll through the reviews and I'm not alone. I'm retired and home EVERYDAY, I really don't NEED that many clothes....but ON has an excellent selection of comfortable leggings and lounge ware. Retail therapy at ON during COVID helped me, until the new app. Just fix it please.",1
2021,Home page works fine but I haven't been able to go to any sections or see any actual products in at least a couple of weeks. Everything just pops up with a something went wrong page. There have been a couple of updates since but they haven't helped.,1
2022,"I constantly get ""something went wrong"" pages and when you refresh it reloads the error page and you get stuck in a loop. Nothing will add to my cart because of this error. I've been wanting to shop for a a few days and just gave up because of this app.",1
2021,"The ""new"" app is horrible. I haven't purchased in a while because it's too complicated to use and rarely works as I'm always directed to refresh and refreshing doesn't fix problem. Combining the women's sizes into one shopping department has made it harder to shop my size. Not a fan.",1
2021,I haven't been able to successfully use the app once. Its unavailable or crashed on me. Also on the old app I had the ability to manage my credit card account and that doesn't seem like it's even an option now. Definite downgrade.,1
2022,"I would like it more if it didn't glitch where you have to sign in every time you open the app. Also, you can't use physical super cash that you got from the store for online orders. I tried everything with multiple different ones and they never work so I either have to go to the store or let them expire.",3
