Year,Review,Rating(out of 5)
2021,I can't pay my balance on the app. It gives me error messages every time I try.,1
2021,"Every time I try to sign in it tells me I have to verify my identity on the website.. the app doesn't work, what's the point?!",1
2022,very easy to use and to navigate through and the deals they have are amazing,5
2021,"Easy, simple, and fast to shop. Love this upgrade of Old Navy App.",5
2023,Nothing everrrr loads. Just spins and spins. Can't shop on the app at all.,1
2022,Can't use super cash with other discounts. Not very fair being that I earned the super cash.,3
2022,Why would anyone use this when you spend time filling your cart just to have it deleted because you have to prove your identity by logging in again?! Gross.,1
2022,"Updated today - shopping cart is now unavailable. Normally, app rocks!",2
2022,Great variety for the whole family. Great discounts with old navy credit card.,5
2022,cheap but nice clothing to make yo feel like the best you possible . Greatness with a budget,5
2022,Quality and sizes for the entire family! You can't go wrong. Especially for all y'all tall folk out there!,5
2023,"Great fashion,great pri es.most of all good quality.",5
2023,Just a nice way to shop,5
2022,App has gone down hill the last couple of years. Making my last payment and deleting this travesty of an app.,1
2022,"Everytime I open app, it says I need to update but there is not an update available.",1
2021,I love old Navy. They have really good quality clothing and great deals.,5
2021,I LOVE Old Navy gear! They have sales ALL THE TIME & i love the quality of their clothes!,5
2021,I have good experience with old navy for different step everytime I need help I'm always found people to help me.,5
2021,I love that I can always count on the latest trends and classic vintage styles that never go out of fashion.,5
2022,Half the time it doesn't load or tells me something went wrong and still won't load.,3
2022,"Terrible, I have been trying to checkout my order for a few days now and keeps saying sorry something went wrong.",1
2021,The app y running slow and when I want to see my orders in my account it says there's an error.,3
2022,It makes me re-download the app EVERY TIME I go to use the app. Very annoying,1
2022,I love Old Navy store options.Great deals and beautiful clothes for the whole family.,5
2021,Home page loads and then anything you choose it says something went wrong. This app is useless.,1
2022,Login issues. The app keeps logging me out. Very frustrating.,1
2022,I had purchased more items but it would not let me do a split payment with a gift card and my credit card so I put a bunch of stuff back your loss,3
2023,I love Old Navy. But this app stinks. LOL it always kicks me out,3
2021,I prefer the previous app. I'm unable to access all necessary info. Thumbs down.,1
2021,Pages won't load. Refresh notification always popping up! Terrible!,1
2022,"Logs me out often, which is a nuisance when I want to shop, but other than that it's a good app.",4
2021,I LOVE Old Navy!! love the new app- super easy to navigate and checkout!! Loving it!!????,5
2022,Very slow app. Doesn't work good anymore. constant updates.,2
2023,when I shop early I can always find my size,5
2022,Out of date clothing and app is super slow. Some pages don't even work,1
2021,I love the fit and quality from Old Navy. Their rewards you get are awesome as well,5
2021,"I had issues with the ""something went wrong"" thing too so I uninstalled it, installed again and now it's fine.",4
2023,Lately the app hasn't been working. It won't open up the clothing categories.,1
2023,Concept is great but the hardly ever works.,2
2022,yeah your app is terrible It wouldn't even let me sign in I had to do it as a guest what is wrong with you guys I love Old Navy clothes I don't appreciate your app.,4
2021,I don't shop in Old Navy that regularly so I can't said to much about it. But my grandchildren loved it.,4
2021,"love the deals! great quality, especially for my little ones.",5
2023,"Great prices, great value. Clothes are well made and durable",5
2023,Takes forever to load,2
2023,Awful app never works.,2
2023,cannot seem to ever get the pages I need to load. something always goes wrong.,1
2022,"App is s***. Tells me to ""get new app"". Already have. Update at every open. Can't sign in.",1
2021,It Wont Let Me Use All The Menu Options In The App...It Is Useless And I Have To Use A Browser To Get What I Need...I Uninstaled It Because It Is Just A Waste Of Space...,1
2021,Improved. Faster and easier to navigate.,5
2021,Love Old Navy store! They built a new Old Navy in Western Hills plaza now. It's very nice and clean. Convenient too!????,5
2022,This app stinks it wont let you sign in half the time it tells you to sign in but it does nothing. I hate it,1
2021,Always says an error message and to refresh. Worthless.,1
2021,Good quality and style of clothes. Wish they have more stock in the stores.,4
2021,The clothes are great but the site isn't user friendly. It's easier to shop in person.,2
2022,The sales and the price are great. The quality of the clothes are awesome!!,5
2022,"I literally can not use this app now. I've even uninstalled and reinstalled, and it won't work.",1
2021,Literally every single time I attempt to log into the new app it crashes.,1
2023,Slow and half the time just keeps thinking but doesn't ever pull up anything.,3
2021,They have good deals I just wish they restock their items quicker that everything is always sold out,4
2021,Can no longer find a way to pay my old navy bill when i open app jerps saying download app when its already downloaded like the other old navy app better was much easier now i have to find a way to pay my bill,1
2021,Can't get into the shopping area everytime I click on pajamas it says oops something went wrong refresh n still do the same thing,1
2022,"I had given oldnavy 5 stars, but I am not happy after the recent updates... app doesn't run smoothly anymore.",1
2021,Total downgrade. I'm on old navy the most but I liked gap factory as well now I can't even get to it.,2
2022,"Always frozen, like always. Takes forever just to look up one item.",2
2021,"After last update, the app won't let me shop. Uninstalling as it's useless.",1
2022,"Please fix the bug!!!! It keep saying something wrong, to fresh the page!! ??",1
2022,This app rarely works and the large amount of glitches make it extremely frustrating to use.,1
2022,Takes absolutely forever to load the page. Not worth it at all.,2
2021,The new update won't let me open the app!!! It keeps closing on me!!! Wth,1
2021,"I love the kids selection and the pricing, especially the discounts.",5
2022,This app NEVER seems to be working. It's extremely slow and always buggy,1
2021,Easy to navigate. Tons of deals and cash back applicable!,5
2023,This app never keeps me signed on and has a tough time loading anything. Old Navy please fix!,1
2023,"This app has been very slow the past couple of months, but now it will not even load anything.",1
2021,"Very easy process. Easy shipping options, and in-store pick-up.",5
2022,Loads slowly or not at all. One screen says to sign in while another says I already am.,1
2022,Cannot access shopping bag for days now. Error after error.. same... Months later... Since your latest update,1
2021,It always takes me to download updates page even if I was just in app. Hard to make pmts.,2
2023,"so cute, easy to use, and you rack up points quickly. something for the whole family",5
2021,"Don't like that I have to spend 50.00 to get free shipping. Also, some items are still expensive even on sale.",5
2023,"The app is always having issues, I can never use it and it is just taking up space now on my phone",1
2021,"I love old navy and there selection on clothes for literally everyone , not to to mention the fantastic sales",5
2022,"This app is horrible!! Waste of time downloading it, it mostly never works!",1
2021,Horrible!!! I have to download it EVERY single time I try to open app.,1
2023,"All I get is a ""something went wrong"" message anytime I try to click on anything.",1
2021,Freezes and times out way too much. Not worth the hassle.,2
2021,"I love the online discounts, the dresses. I'm an old navy shopper.",5
2021,Old app was better! I just want to go to my billing and make a payment!,1
2021,App doesn't work. Error occurs upon opening the app each time.,1
2022,"Looking for discounted end-of- season bargains, women's petites .",4
2021,"everyday sale is addictive! plus I love the texture of the shirts, so soft and comfy ??",5
2022,Makes me sign in every time and loads incredible slow(if at all).,1
2023,This app barely works and constantly makes my phone crash when I try to use it.,2
2022,The app literally never works. It always shows the loading sign.,1
2022,Can't use the app! Cannot get passed the update screen.,1
2023,Love the clothes but the app glitches too much and isn't accurate enough to make it worth it,2
2023,The app rarely works. I haven't made any purchases in a long time because it is impossible to do so.,1
2023,I can be half way down the page and it jumps back to the top. I'm not able to see all of the products.,1
2022,App takes forever to load. It's easier and faster to use the mobile website.,1
2021,"Keeps crashing, won't let me see anything when filters are applied",1
2021,Great products and sales. Love the shop online with curbside pick up.,5
2022,"I've been trying all morning to checkout. I keep getting ""UH OH something went wrong"" I guess they don't want my money",1
2022,"Love Old Navy Jeans they fit well, they look good on and they are of good quality. I love them.",5
2022,"I know when I can't find what im looking for in store, I can always find in online- and I always find great deals online",5
2021,Tabs are glitchy. Everything drags. Adding promotions or discounts is difficult.,1
2021,"This app keeps closing, I can't add anything to my bag. I wasn't able to do anything. I want the old one back.",1
2022,great prices and lots of clothing options to choose from. ??,5
2022,"Shopping online Old Navy is so easy, and the points accumulated are the best",5
2021,The app doesn't let you check your orders. It just says try again something went wrong.,1
2022,"I love their clothing. great quality, the only thing I don't like is their Sherpa clothing...does not wash nicely even though I follow the washing label instructions.",4
2021,The app keeps crashing! I liked the old one much better.,1
2022,"Not a lot in plus size. Hard to find bottoms, capris or nice blouses.",3
2022,Was a solid 4...the previous app was more user friendly...you are loosing what could be sales.,2
2021,Always great quality with a wide selection and great prices!,5
2021,they need to update when items are not in stock so they don't show up when you're shopping,4
2022,fast shipping.. items are very nice.. love having plus sizes in women and men's. love the sales..,5
2021,"Cant even get to the authoraztion screen to make a payment. You get kicked out, i tried 15 times ??????",1
2023,"Terrible app. Y'all need to hire some new developers, your current ones lied on their resumes. Yikes.",1
2022,Constantly logs me out. Glitches terribly. It's just a horrible app.,1
2022,Missed my payment beacuse I can't log in. It keeps telling me I don't have permission to access this page.,1
2021,Love the style and selection! Great for my whole family!,5
2021,"Go back to old app! New app doesn't allow you to access orders, please fix.",2
2022,App no longer let's me sign in. Changed my password and everything. Just takes up space on my phone,1
2022,It doesnt give me the option to switch between the visa and the instore credit card anymore.,5
2022,The nicest clothes and accessories for the best prices. I cannot say enough good things about Old Navy.,5
2021,Great Store! Love all the great deals durning School shopping cute tops for my daughter's .....,5
2021,App will not work. Keeps telling me to refresh the page. Sucks,1
2022,The only app that makes you log in at every breath. Stop it! Save our info and make it better,1
2021,I love old navy but this new app sucks big time. I like the new set up but it doesn't function properly,1
2022,"Love ON kids clothes, great fit & looks. Don't care much for how the shipping works but??",5
2022,"Tired of having to update eventide I go to use app, it just updated 13 days ago and now again.",3
2023,Super glitchy. Constantly logs me out. Won't load half the time.,1
2021,"Old accounts are not migrated, after creating new account and logging in application keep crashing",1
2021,Would be helpful if it didn't keep saying that something went wrong and loaded the page already.,3
2021,"Horrible App! I cant access my wallet to paymy bill, see my rewards etc. Fix it please!",1
2022,The new update is awful The app keep asking me to refresh and sign up over and over!! Please fix this!,1
2022,love the app quick and easy always keeps me informed of any deals going on.,5
2023,Shopping is great always receive my items and what I ask for plus great way for me to get my Old Navy card balance,3
2021,"Needs to keep your place when looking at an item, then backing out to the department",4
2021,App will not load past initial screen. Cannot search or load options.,1
2021,I just love old navy! the app is super easy to use. There is never an issue.,5
2022,Awesome!!! Love the store. Great sales and love the curbside pickup.,5
2021,I love old navy and all the awesome deals and awesome customer support.,5
2021,The app never works. Always crashes on any page I click.,1
2021,tried to sign in to my account but password line was covered by a button that would not go away. Had to make a new account,1
2021,I like shopping at old navy for my girls. Cute affordable clothes when they have 50% off days.,5
2022,"App now has a constant lag, cannot even do any shopping as nothing loads.",1
2023,"Constant crashes and stalls, and less features than the website.",1
2021,have to catch the deals and when you do it's a great haul!,5
2021,"All I get is the ""something went wrong"" screen when I click on any category.",1
2022,"Since the update, I can't add things to my cart. What use is a shopping app if you can't shop?",1
2021,Easy to use and easy quick access to coupons and discounts,5
2021,Bring back the old app. Search is awful. No clearance button.,1
2022,Doesn't let me check out and makes me constantly login. So frustrating!,1
2023,Won't sign in. Just says I need to update but I already tried. Even deleted app and reinstalled.,1
2023,Okay app. It's what's available. Good wallet but Checkout can be glitchy.,3
2021,Easy to order and option to pick up from a store is great,5
2022,Super cash is a pain. Why is there a paper copy? I'd like to enter it into app after in store purchases.,3
2021,Won't even log in account after 3 resets. Ended up ordering from Amazon instead,1
2022,"App updated and now I can't shop at all. Nothing will load, screen just white.",1
2023,total old navy lover i ONLY were their jeans all the time and their tops a great also top to the bottom we are covered in old navy,5
2022,"Old Navy is awesome.However, the log in process needs to be fixed.",4
2022,Having to sign in EVERY SINGLE TIME is not convenient. Makes me not want to shop at ON.,1
2021,"love old Navy's clothes and prompt service, great prices and service. ?",5
2022,"Always an issue when checking out , I have to sign out & open in browser to check out",1
2022,"login could be easier, but once logged in shopping is easy.",4
2021,"There when I need the most!! .... great prices, great varieties!!",5
2021,App won't load. I've tried re-installing several times,1
2022,I love Old Navy because they always have a sale going on and they always have cute clothes.,5
2023,"Crashes all the time, rarely works, absolutely not usable",1
2022,You need to fix your sign-in page on the app you can't sign in there's nowhere to sign in at please fix your page,1
2023,"The app doesn't work anymore?? It doesn't open and if it does, it doesn't let you log in",1
2021,I can't even get it to open... the notifications seem to be work though.,1
2022,I love the deals! Quality items for reasonable pricing.,5
2022,Glitchy and won't even open now. Hard to shop when it keeps doing that.,1
2023,This app is the worst. It always tells me there is a problem. I have never been able to shop on the app.,1
2022,I LOVE Old Navy! This app makes finding the perfect shirts easy and fun.,5
2021,"I can't even shop on the app, it keeps crashing no matter what I do.",1
2021,Didn't work besides the home page with a few ads even thing else is a error,1
2022,the app never works always says something went wrong better off taking down the app and just use the website,1
2023,love most of the styles and the clothes seem to fit better than a few years ago.,4
2022,crashes all the time. have to constantly refresh,2
2021,I can't even get the app to download. The old app took me to the Google Play store and... Nothing.,1
2021,"Horrible app. it never works, even with the most recent updates.",1
2021,This app does not function at all on my Samsung S20 FE - ontinually shuts down. It doesn't even deserve one star.,1
2022,Keeps crashing whenever I try to add anything to my bag or even access my bag.,2
2022,The app is difficult to navigate. even signing in is glitchy.,3
2021,Inexpensive clothes for the whole family!! Great sales!,5
2022,This app is extremely slow and won't even open 90% of the time.,1
2022,"Store is good, app is horrible and unusable. You're better of in a browser",1
2021,I love Old Navy. The clothes fit great and the price is just right.,5
2021,"really easy site to navigate, lots of savings and promos...",5
2023,the ON site has glitches but the quality of the products is very good.,5
2021,Using the Old Navy app totally makes shopping easier and faster.,5
2022,Quick delivery times. best quality clothing at an affordable price,5
2021,I am unable to enter my password via the app because the sign in bar is covering the password field.,1
2023,"many size options, fair pricing and always discounts offered.",5
2022,"Terrible app! Super glitchy,can't refresh,won't save favorites.",1
2022,Don't like having to keep updating this app don't have the space on my phone and now I can not pay my bill...not fair,2
2021,Crashing over and over cannot use anymore. Started yesterday,1
2021,Was working fine. Now it force closes everytime I try to open the app.,3
2021,New app only says that something went wrong. Can't see any of the products. Terrible!,1
2021,"I can't do anything, always getting 'something went wrong' message. About to delete app",1
2022,Can't even Open app! Cleared data and cache and still nothing!,1
2022,always a great selection always great quality which they make more graphic tees ??????,5
2022,App is super easy to use and they're always great deals!,5
2021,very easy to shop from the app! easier than going to a website,5
2021,The fact that all women's items are available in plus size is awesome.,5
2021,Even though I have the app updated it still brings me back to the play store every time I open the app.,1
2021,New version keeps crashing. Not user friendly.,1
2021,It is my go to place for everything. My favorite place to shop for my toddlers.,5
2021,Great selection of clothes and always good sales and super cash promos!,5
2023,"Great items, variety of sizes, easy. to navigate",5
2021,This app has never loaded. I still have to launch it from the old app.,1
2023,"Never loads, even after updates. All the pages remain blank",1
2021,Supposed New APP SUCKs DD!!!!!!!!!!app always asks to load new app and kick me out everytime I try to log in.,1
2022,"honestly, app kicks me out and it ends up just being very slow.",1
2021,"i love old navy and the rewards, the deals are awesome!!!",5
2021,I hate this new app...works once in a while..never consistent. The old app was better..never a problem.,1
2021,Great app! Notified of great deals as they pop up.,5
2022,"Have way way too much trouble signing in and ordering then trying to check out Please help fix this,",1
2022,Doesn't work. Just a blank page appears with the Old Navy logo.,1
2022,"practically everything I own is from old navy. but the app sucks sometimes, so 3 stars.",3
2022,The latest update ruined the check out. Constantly says something went wrong and to try again.,1
2021,Comfortable and good quality clothing for reasonable prices!,5
2022,"I Think That You All Are Doing A Wonderful Job ,At (What???) You're Doing Because We Get Too Shop On Here And Then We Also Have To Pay For It,,,,When It Comes Too Us,,Or Either If We Have A Credit Card,,,And Then It Still Comes Too Us Anyway To Bye For Now.",5
2022,Loved it at first but now whenever I open the app it automatically crashes ??,3
2022,"It has been good to me for almost a decade now. I just started shopping the app, but thank you old navy life saver",2
2021,"my sister bought me these for a sister's trip later, but I've worn mine so much before hand that I have to buy a new ?? ?? pair for trip I LOVE THEM, ? SO COMFY",5
2021,"I love old navy... Customer Service fantastic, easy ???? shopping ??.. lovely experience..",5
2021,"I've would have gave this app 5 stars, but the app still freezes time to time.",4
2021,"one of the few stores I can walk into, get what I need without trying it on. The fabric used for the t-shirts I love",5
2021,"The app is not working properly. Just keeps saying ""something went wrong""",1
2022,I Love the low prices. The tank tops last all Summer. And then some ?????,5
2021,Easy to use. Love the clothes. Good value for good quality.,5
2021,Very easy to use and helpful for shopping!!,5
2021,"The quality of clothes, the price point and the service is amazing!",5
2023,Always issues with it being slow or not loading anything when you try to shop,2
2023,don't like the fact that it refreshes whenever I add an item to my cart.,4
2021,Very difficult to navigate between shopping and credit card services,3
2022,"App is not working! Keeps saying, something went wrong!",2
2021,Never have been able to get this app to work it always says somethings gone wrong.,1
2022,Great deals and comfortable clothes that are also stylish!,5
2022,clothes are great quality and they have awesome deals/rewards!,5
2022,Constantly crashing. Not functional at all.,1
2022,The app takes forever to load and it's not as comprehensive as the website.,2
2022,great deals and quality... keeps my little girl looking good for an occasion,5
2021,Can only purchase as guest. Redundant check out. Always asking me to go to website.,2
2022,Easy online shopping app and very cute looking clothes and good deals.,5
2022,"App too complicated, only able to make payment thru email.",1
2021,App doesn't work it gives an error everytime you try to look at items,1
2021,"Terrible, nothing loads. Like they say why fix what isn't broken.",1
2022,It wouldn't even let me create an account to get into the app. Never got to use it. Trash.,1
2021,Very convenient to make purchases when having a very busy life,5
2021,Can't check order status; uh oh hit refresh and try again. PITA!,1
2022,sometimes the app is slow but some of these clothes you can get from here is just awesome,4
2022,the app is slow and needs to be refreshed often but easy to use,4
2022,the app is very buggy - but old navy is a very good store.,3
2021,love the clothes and my traditional Christmas pjs! yay! love it all! pretty sure indie like 4 orders! Lol,5
2022,"Cannot even open the app and it is crashing, what a trash app.",1
2021,Nothing loads on the page. Error message says to refresh.,1
2021,Love the styles and sizes! Great for the entire family!,5
2021,There's no space for username and password?? Why use the app at all? Really disappointing.,1
2021,I like alot of the items. The problem is they hardly have my size.,3
2022,Old Navy always has great deals and wonderful promotions!,5
2021,Keep getting error message. Can't use the app at all,1
2023,"Old Navy is great, but this app only works half the time. Is it that hard to make it functional?",3
2022,Great selections for all gender/gender neutral and for all shapes and sizes.,5
2021,I've not been able to sign in since you revamped your website. Made me start shopping more at Belks.,1
2021,Easy to navigate and shop! Great Application!,5
2021,Tired of keep updating new app..the old ones are fine..it happens to much..,1
2021,"It doesn't work! Even after update, there's no working app .",1
2022,"I always buy my daughter's uniforms for school from here, can't beat the prices and comfy clothes.",5
2021,It's always stopping. Ever since you started the new app I haven't been able to shop.,1
2021,I buy all my jeans at Old Navy. They are the perfect fit for me and that's hard to find.,5
2021,"Great deals, but you've gotta look to find them.",5
2021,Clothing is good quality and prices are affordable.,4
2022,Doesn't work well .. Sometimes pages won't even load. And i have Internet connection,2
2021,App doesn't load. Keep getting something went wrong alert.,1
2022,I love Old Navy! I jusy got 9 pair of jeans for $68!!! You ca t beat their prices and quality.,5
2023,Best prices for great casual clothing. why pay more? Check Old Navy first!,5
2021,"Very quick and easy. Love shopping for my favorite clothes from O.N. B.R., and Gap. Wish your stores would open near me soon",5
2021,This app is terrible. Can't open it. Error messages.,1
2021,"Its not even loading pages. I can't even shop. Havent you ever heard the phrase, ""dont fix whats not broke""?",1
2022,Won't load up any items. Always says something went wrong.,2
2022,Have to log in multiple times for every button on the app. Pointless,1
2021,Super cute clothes! Affordable and stylish....and so comfy!,5
2022,easy to navigate and good deals overall.,5
2022,App crashes too much. Takes for ever to load or sininply does not loads at all,1
2022,Cant ever sign into my account because i cant put my password in the way the app is designed i guess please fix this,2
