Year,Review,Rating(out of 5)
2021,"I love old navy but I absolutely hate that they don't give free shipping to card members. spending $50 to earn free shipping is high. while I like the clothes they don't last long, they also tend to shrink so I size up.",3
2021,The new app wucks the only reason I have it is to pay my credit card and there is no way to navigate to it. SUPER FRUSTRATING. paying off my catd and cutting ut up. Done with this store.,1
2021,"Looking at any item is frustrating when ever you hit back to view more it jumps to the top, making you start over. I had to give up.",2
2021,"Terrible since the upgrade. I have deleted and reinstalled it multiple times and I still get the ""something went wrong"" error every time.",1
2021,Initially this app has been working great. All of a sudden the app closes out. Unable to use. Will change the stars once app starts back working...,1
2022,"Horrible app.. it's all blank white pages, and if something does show it is telling me I need to refresh the page. App has been like this for a while now. Please fix this.",1
2021,"Won't work. It opens but every time I try to click to shop on something I get an error message telling me to refresh. But no matter how many time I hit refresh, it still doesn't work.",1
2022,I haven't been able to open the app in days. It's just stuck loading and I can't look at anything. It also logs me out of my account every time I close it and it's a huge pain to log back in.,1
2021,"Customer update: the app has not worked since last update. Very disappointed. Isn't working, I can't pay on my credit card. I haven't shipped on this one yet, but I don't have very high hopes",1
2021,"Was good, except kept showing the same items, just in a different color. But, now I can't login. The line to put in my password is not visible.",3
2021,"Seriously with the scrolling! i think this is the most inconvienent frustrating shopping app ive ever had. Scrolling to find an item, look at the item and be forced to start ALLLLLLL over back at the top... ugghh id rather just not.",1
2021,"App was easy to use. I wish that when you went out from looking at an item, it would return back to where you were the page instead of the top.",3
2021,If I click on something in my search and then go back it starts me all the way at the top and I have to search for where I was on the page. So frustrating I'd rather just look on the web or not at all. Please fix,2
2021,"New app is terrible, doesn't even work. It constantly tells me to refresh for my rewards then says it's not working....it's been doing this for over two weeks.",1
2022,"Will not let me sign in?? I've un-installed and reinstalled multiple times and it repeatedly says oops something went wrong unable to log in try refreshing. Refreshing doesn't work either, it just times out.",1
2022,"This app never seems to work correctly. Sometimes it will not load pages and is so slow. I've given up ordering numerous times. Do better, ON!",1
2021,"This new app does not work on my android phone. The app says something went wrong and regardless of how many times I refresh, I cant move past the error.",1
2021,"Garbage, keeps going back to the main old navy loading page. Can't access the factory shop for gap or banana republic. Bring back the old app or get better developers that actually understand UI/UX.",1
2021,I give Old Navy 5 stars for affordability and delivery. 1 star for the online shopping. I find it shady that there is no apparent way to redeem old navy cash on the computer website. I have to use the app on my phone to take advantage of the cash I've earned,5
2022,"Love ON and their clothes, used to love the app too. But recently I'm unable to sign in and add things to the cart. Hopefully they'll push out another update and I can go back to shopping!",1
2022,"It keeps making me sign in due to ""inactivity"" but it has made me sign in twice in the same sitting before. I also don't like that I have to sign in to try take a closer look at products, which wouldn't be an issue if I could just STAY SIGNED IN",2
2022,Slow. Everytime I open the app I have to log in. It won't log me in a lot of the time. I usually always have errors and I get frustrated so I just visit the website.,3
2021,"Frustrating to scroll through hundreds of images, click on one and then when you return to the list it puts you back at the top!!",3
2022,"Old Navy has tons of pretty clothes, but I wish they wouldn't change their sizing/styles so soon. Many of their tops are now too short for me to wear which is a bummer because I really like their stuff.",4
2022,"Everytime I go to do anything with checking out or putting clothes in my ""saved for later"", it tells me to log in... I log in, takes me to the check out, put a item in saved for later, have to log in AGAIN. I've done this over 10x already.",2
2022,The current app is not good. I'm constantly logged off and have difficulty logging back in. There should be a way to empty the entire cart at one time. Cannot believe such a major company has such a bad app.,2
2022,"I like the quality of the clothes but the app has some glitches. I have to log in every single time I want to use it, if I leave the app to answer a message, I have to log in again even though I was out for just 2 minutes. It annoys me.",3
2021,"I love this store, but for the last few weeks the app doesn't work. As soon as I try to open it, it closes. I've uninstalled and reinstalled it a few times with no success. Very annoying",1
2021,"Love the styles, app is easy to use, you get rewarded for buying things you love, they accept Afterpay so you can break your purchases down into 4 easy payments! Amazing ??",5
2023,Team Old Navy! I absolutely love that have clothes not only thin women but plus size women as well! they clothes lasts forever! I have been shopping at Old Navy for years and will continue shopping there!!,5
2023,"The app refuses to let me select a category (men, women, girls...) and keeps telling me there is an error and I need to refresh. So much for an ""update"". I'm try online vs the app.",2
2021,"Completely confusing....who was the wizard that came up with this? Isn't the point to have LESS CLICKS to get where you're going??? I'm clicking everything....still can get to my destination. Poor, very poor!",1
2023,This app sucks. Half the time it tells me something went wrong. When it does work it is so slow I usually just give up. Also it doesn't keep me signed in. Get it together Old Navy! I'm over it.,1
2021,On my Samsung 21s you think you've opened the app but haven't. One must open account then sign in. Signing in should pop up first every time. And the tracking of rewards NEVER works. Have to keep paper,2
2021,"I can't sign in to my account using the ""Sign in"" button. The sign in screen is over lapping with text. Anywhere I tap to guess at where I enter my username-nothing happens.",4
2021,"Been shopping at Old Navy since 2002. Always satisfied with great assistance at every location. Even though I won't be approved for the ON credit card, I will always be a loyal customer!!!",5
2022,"This app is not working! I get an update available message and try to update but it won't. I have also tried to make a payment and I am unable to...it caused my payment to be late ?? In conclusion, this app sucks.",1
2022,"For some reason, every time I open this app it tells me I have to go to google play before I can use the app. I thought maybe a few updates would help but it's still happening. It's incredibly annoying.",2
2021,"DO NOT allow the update it comes with nothing but glitches. The same goes for the Old Navy Credit Card site, it's so glitchy that you have to try MULTIPLE times to simply pay your bill..",1
2021,"It hasn't worked for literal months. Every time I try to actually shop, it says ""Something Went Wrong"". Nothing but the home screen loads. What's the point of having an app that doesn't even work?",1
2022,"Don't order from Old Navy, Gap, or Banana Republic. They WILL sell your personal info and there is **no way to opt out**. Enjoy endless calls and scam emails that will make it through your filter due to it being part of their ""subscription"" you never opted into.",1
2023,No matter how much I update app it's so buggy. Looking thru clothes it without clicking anything takes me all the way back to the top. Over and over. Maybe it's a sign a shouldn't buy anything!,1
2021,"I cannot search anything ""Something Went Wrong"" pops up on every search. Even when I try to go by department and category the same error message comes up.",1
2021,need better selection online. It's sad when the only women's jeans that are ever on here are skinny jeans. there are a lot of women that don't like that look. Old Navy was one of the few places I could find jeans that fit me right. Very disappointed.,1
2022,"I love ?? this app! I shop here all the time and I am so happy with all my purchases. I hope they keep doing it right, I'm a plus size girl and all the selection is awesome. I look and feel great in all old navy??",5
2021,"Love Old Navy, need better consistency on sizing....I'm the same size and I order the same size but sometimes what I order feels 2 sizes smaller. More variety of clothes would be great too.",4
2022,Log in is a nightmare. I have had the same password for an over a year. Every time I try to log in is it rejected until I reset it.,3
2022,I most shop online. Love ON and the fab sales. I think their clothes have improved since my daughter worked at Old Navy in Lincoln City. Love the vintage sweatshirts. I have every color now. Please make some different colors.,5
2022,"The app rarely loads, doesnt save login information, and crashes regularly. Whomever works for the development team may need some overtime for training.",1
2022,I love that they have options for talls for women's pants and are affordable. I took away one star because the app on phone is buggy and does not display well at all and hard to look at maternity options,4
2021,Worst app ever can't get old orders can't look up anything can't pay bill. They need to go back to old user it worked much better than this knew one. Might have to cancel card because app is just horrible.,1
2021,It shuts down every few minutes. I have to enter my password every time to get back in. Every time I view a product and go back it doesn't go back to where I was it goes back to the top of page and you have to scroll down through everything again to get back to where you were.,2
2022,Can't sign into my account on the app. All the words are overlaying the password area. Used the email on the app info to find out it's not valid. Very disappointed.,1
2021,"The updated app is TERRIBLE! There is so many things wrong with it, it's hard to even describe or list them all. It was better before it was updated a few days ago. I hope it gets figured out soon as it's making it hard to shop/use.",2
2022,"Extremely glitchy. Takes forever for pages to load if they do at all. I'm using the website 99% of the time anyway, so I'll probably just uninstall it.",2
2023,Again i placed an order.never got an email or notification from app. item was at the store. store didnt notify me. Item was returned ...bad app bad business.... Please fix your app so that we can pay bills and see orders. What is the point,1
2021,"By far one of my favorite stores, and the deals are unchallenged. I can also say that I have always had a good experience when returning items. 10/10 would recommend ??",5
2022,I 100%hate this app every time I have to pay my bill Ithey seem to be updating the app and I can never log in to pay it I'm not paying a late fee for their stupidity wake up Old Navy and read your reviews. I'm seriously considering cancelling this card for this reason only.,1
2021,"I have to agree with everyone else. The app is almost great, but it's pretty annoying to have to start at the top of the product when you go back from a product page.",2
2021,This app sucks. Won't let me upload my card. Won't let me upload my paypal. Having problems saving my info. So can't buy anything. Tried installing and reinstalling. Just keeps refreshing. Don't bother downloading,1
2022,"Something is wrong with the App. I have uninstalled and reinstalled. Its updated to the current version. I can't checkout. When I go to checkout, I get an error message asking me to refresh.",1
2021,"Never works, not user friendly AT ALL, and password reset fails every time. What kind of people make an app that doesn't work??!",1
2021,"Much better. No need to relogin to check rewards, orders, supercash while shopping. All is there. Additionally, the use of a gift card should not take away any members status for free shipping holding a navyist membership.",5
2021,The new updated app is terrible. It constantly doesnt work and gives error messages. Someone in web/app design should be canned. ??,1
2021,Can a leave no stars..... Jesus Christ! Theirs not even a tab to direct you to pay the credit card. The previous app was fine just the way it was. Change is great just not in this direction.,1
2022,"App takes forever to load. Crashes more often then works. I've tried deleting and redownloading, restarting my phone. Very frustrating",1
2022,"The app has so many glitches. The pages don't load properly, favorites are not being saved even though the item is in stock.",3
2022,"Old Navy never fails. New arrivals are always in the latest trends while staying in the ""Old Navy"" fashion. They never disappoint and the sizing have never altered.",5
2022,"Accidentally put a kids hoodie in my cart, won't let me delete it by hitting the delete button or even making the quantity 0. Tried deleting and reloading the app. Also can't figure out how to set up Autopay on this app. Not user friendly at all.",1
2023,"This app sooo glitchy. Love the deals, not loving the app. Edit: let me be more specific for the devs. I'm on an S21+ and I can't even put a second filter on there without getting a ""Something Went Wrong"" error.",2
2022,"Never had a problem returning anything, good customer service, I can use my Old Navy card at any of their stores, my go-to store if I need something quick. I never give five stars to leave room for improvements.",4
2021,Used app often until it began crashing as soon as it was launched! Tried restarting my phone and reinstalling the app and nothing changed. Fix please!!,1
2023,2-3-23 and it still is AWFUL!!!! FIX YOUR FREAKING APP!!! Sucks. Tired of it not loading!! Update: 2 months later and it still sucks!!! Still not loading and I'm going to lose my super cash and rewards!!!!,1
2022,So many glitches.. the home page will hardly ever load and it signs me out over and over as I'm shopping. It makes it very frustrating sometimes so I just give up and don't even buy anything,2
2022,"Lately the app keeps saying, ""something went wrong and signs me out, gives me the option to refresh, but only leads to same issue. Makes the app non-functional. Please fix this. Samsung galaxy 5G 21",1
2022,"I struggled with this app since June. So I had my husband download it on his Iphone, of course it worked fine. I think it's incredibly disappointing of old navy to be so inconsiderate for so long.",1
2021,"Sadly (according to my bank acct) I love the app, the ease and efficiency of use, the company's products, and their constant deals and discounts a little too much. :)",5
2021,"The app keeps crashing it doesnt even open up, I tap it and it flickers my screen back to its home page with all my other apps showing.",1
2022,"Literally the worst app on my phone. Load times take forever, have to sign in EVERYTIME I open a notification. The offers screen will not load going on 5 minutes at this point. Almost like they don't want you to shop......",1
2022,Good app and great store! Just one feedback: I have to sign in every time I click on the app. I would like to sign in just once and then be done with it.,5
2023,Impossible to shop on this app when it crashes constantly. Hit search to try and find something? Crashes. Try to select a section to shop in? Crashes.,1
2021,They honestly have the best clothing options I've seen. they grow with you or size down with you. quality is good and prices are even better! I can shop for the whole family at old navy!,5
2021,"I absolutely don't see any issues that these individuals are saying. Anyways love the app, way more snappier then before. A little more cleaner and yeah. Again a improvement that was much needed.",5
2021,The first time I tried to add something to my cart the app shut down completely & won't let me reopen. I uninstalled & reinstalled & the same thing happened again.,1
2023,This app is so glitchy and lags so much. Makes it so hard to shop. I just give up and don't buy anything. I refresh over and over and still get error messages. Do better Old Navy.,1
2021,It's about time! Hahaha!?? Super easy and smooth. Has all the functionality of the desktop version. The first purchase was great!,5
2021,When I tap on the app it brings me to the message about the new app to download. I have already done that. Then I just tap open. It does that every time. If I go through my email it doesn't have me do that.,1
2022,I LOVE Old Navy! I hate the app. It logs me out of my account and does not save my password. I need to do it again every time I open the app! Very frustrating!,3
2021,"I LOVE old navy but the app is horrible. Constantly freezes and ""something went wrong"" messages. The app worked decent until the last update.",1
2021,I downloaded the app because the website has a tendency to show unavailable pants even after you've filtered for your size. I guess it's just an Old Navy thing as the app reflected the same behavior. Smh.,1
2021,"Just uninstalled this app. After updates on 7/20, with the new setup of the app I can't see anything except the front page. Click on womens and see no items with an error message. Same with toddler girls, boys and mens, too.",1
2022,Errors since last update. Won't keep you logged in and constantly giving refresh errors. Need to get this fixed as you can't complete an order on the app currently,1
2022,"Since the last two updates, I can't even get any items to show at all. The spinning, buffering wheel just turns and silently laughs at all my attempts to window shop.",1
2022,"Always logs me off, constantly crashes, when I want to check out it gives me an error message and to try again later. I just started using the browser instead.",1
2023,Sometimes when I click on an item and try to go back it takes me all the way back to the top of the search and I have to find where I was. The app doesn't load often and I have to keep closing it and restarting it.,1
2021,Says it updated 4 days ago but have not been able to load things for a week+ nothing loads and can't be refreshed. Even when the app was working the app is clunky and not super great,1
2022,The app won't let me check out. It keep stating that something went wrong. I didn't have this issue with the older version. I keep the app updated so I don't understand the issue.,3
2021,"Unable to shop with new updates. It gives a landing page but when I click on a dept or picture, it errors out.",1
2021,Love the random sales and that options come in TALL!! Occasionally some different (strange) items and too many cropped! ;-),4
2023,"This is hands down the worst app I have used. It never works. You are never able to check out on it. There is always an error, it removes things from my cart, it never works.",1
2022,It's so glitchy and slow. I don't know what yall need to do to fix it but do it! Half the time I don't buy from old navy is because of this app. Other brands are able to have apps that do everything this app is supposed to do but better. Why is your app so slow and glitchy?,2
2023,"Takes forever to open when browsing, does not filter accordingly, goes back to the top of the page each time an item is viewed.",1
2022,"Will this app ever work again? I would love to take advantage of the current sales, use my rewards, etc. but the app never works! Can't sign in, can't use my points...I hate shopping in store because it's always a mess! Fix the app!",1
2022,"You can't update the cart. You can't update the quantity. You can't save fornlater. You can't delete an item from cart. I need to shop but the cart is stuck. I've updated all my other apps on device. I've logged out, logged in, still can't change the cart items.",1
2021,"Very poor app, at the sign page , can't allow to put password, the sign on tab is blocking the password tab. And won't let you do automatic payments.",2
2021,"After the last update the app is unusable. Just says ""something's wrong"". It was not user friendly before but now it's impossible.",1
2022,"Links to major categories don't work (girls just breaks every time it's clicked), doesn't keep you logged in (as in, logs you out of your account within minutes while shopping). Please hire people who have any clue at all about what they're doing. You're a major brand and this is just embarrassingly bad.",1
2021,"Updated the app 10/26/21 but now I can't search for anything or even view by category without getting the message ""Something went wrong"". Clicking Uninstall...",1
2021,"I have NEVER had a problem getting my Rockstar hi waisted stretch skinny jeans. Now I have been watching and checking the stores, on-line and my sister's store in Tyler. What is the problem. I have a lot of midrise but had to give away because of a really bad back and hi waisted don't cause me the pain and I can't buy them. After 6 mos of checking every other day I just now found them on line. Not good as I can only where your jeans the best.",2
2023,"Never loads properly, and when it does, it tells me I need to do an update. When I try to update it, it doesn't give the option to do so. It just gives the option to uninstall or open the app.",1
2022,"Why can't I purchase anything? Every time I put something in the cart, it says sorry there was a problem, ""refresh"". And I refresh and nothing changes. It's been like this for over a week for me. I've missed sales because of it.",1
2021,"Suddenly can't do certain features without receiving a refresh notice. Have been unable to checkout for a day now, really sucks.",2
2021,"Traded down for this app! There is no way to sort your search results?! If you look at an item and then go back, you go back to the TOP of the search results page?! AWFUL. Did you not test this app at all???",1
2021,"Their returns are AWFUL, seriously, absolutely terrible. But the clothes are good and decent quality, just return ASAP if you don't want it or if it doesn't fit.",2
2023,The app doesn't work and it's constantly crashing within 3 seconds of opening it. This app always had problems but this is ridiculous,1
2022,App is garbage. Nothing will load the blue floral shape thing just spins. I've tried several times over 2 days. Deleting the app.,1
2021,"Like some other reviews I'm unable to browse. Gives a generic ""uh oh something went wrong"" with a refresh button. Even if I wanted to use this app I literally can't. And it's also the only one to my knowledge that I use doing anything like this",1
2021,Filters don't work a lot of the time. I have to log into my account on the computer because it won't let me see my orders on app. Refreshing does no good.,3
2023,The app is extremely slow and sometimes doesn't load at all. The website has the same problem. Both definitely need some work!,2
2022,"SUCKS now! Every time you wanna actually buy anything you land in an endless loop of ""please sign in"" or ""oops something went wrong!"" or both. Apparently ON doesn't want any more of my money.",1
2021,Old navy is great especially when you can get ahold of items on sale. The discount allows us to get more for my 3 boys & otherwise would make it difficult. Most items & material are made well for my boys. Denim is great.,5
2022,"Can't even sign in without 'something went wrong. Please try again later'. Forever loading screen when I try to shop, even though my wifi is fine. Just not worth the headache.",1
2022,it's always a pleasure to shop Old Navy online. the process is easy and the styles are great. the deals are fantastic.,5
2021,App keeps shutting down. Definitely not user friendly when it finally works. This new app is not an improvement; it is much worse than the previous app.,1
2023,"Lately the app has not been functioning well, or is erratic and disrupts the shopping experience. I just give up and quit trying.",3
2021,"Need more jean options. There seems to be a limited amount of jean options, especially for men. Yes the summer screams shorts but nevertheless, there shouldn't be a shortage of jeans.",4
2022,"Old Navy has been the go to back to school shopping place for my family and I since I was a kid . Now, I get to shop for my kiddos with a brand that I can trust that's also affordable (gotta know when to hit those sales and thank you Old Navy for having them).",5
2022,Always have a hard time trying to pay ma card. Every month is the same. Always send my to dowthe app that is already downloaded. Right now I'm trying to do it is frustrating.,1
2021,"Why, oh why, do you go all the way back up to the top of the list every time you hit back after viewing an item? It would be such an easy fix to have it return to the item you were JUST viewing.",1
2022,"Great, unless you want to view things or place an order. It hangs often, making it virtually unusable. Go to the web site instead.",1
2021,"You can't even pay your card. Every time I either try to log in or to try to process a payment, it tells me something is wrong. I've even tried re entering everything but it doesn't work.",1
2021,"Needs fixing, unable to sign in; sign in button overlaps password field. When you finally get in, flash announcements freeze screen; unable to do anything.",1
